{"schemaVersion":1,"durationSeconds":0.92,"animationRootBoneName":"Hips","tracks":[{"targetBoneName":"Hips","path":"ROTATION","interpolation":"LINEAR","keyframes":[{"timeSeconds":0,"value":[0.10412566834926158,-0.0013976561778424976,-0.0013976558778425023,0.994562184232879]},{"timeSeconds":0.16,"value":[0.10340916219074944,-0.012274095770326753,0.10257005736927916,0.9892599633459805]},{"timeSeconds":0.32,"value":[0.10135496608452807,-0.023901445604315254,0.21389812933993535,0.9712895973976579]},{"timeSeconds":0.46,"value":[0.09972669823106914,0.029978223961755122,-0.30040358486847535,0.9481105304478992]},{"timeSeconds":0.68,"value":[0.10370135189564228,0.009494096428204559,-0.10535005611468821,0.9889677737038047]},{"timeSeconds":0.92,"value":[0.10412566834926158,-0.0013976561778424976,-0.0013976558778425023,0.994562184232879]}]},{"targetBoneName":"Hips","path":"TRANSLATION","interpolation":"LINEAR","keyframes":[{"timeSeconds":0,"value":[0.00054026284,-0.018242396,1.2187186]},{"timeSeconds":0.16,"value":[-0.00945973716,-0.038242396,1.1987186]},{"timeSeconds":0.32,"value":[-0.01445973716,-0.048242396,1.1937186000000002]},{"timeSeconds":0.46,"value":[0.02054026284,0.011757603999999998,1.2187186]},{"timeSeconds":0.68,"value":[0.00554026284,-0.008242396,1.2187186]},{"timeSeconds":0.92,"value":[0.00054026284,-0.018242396,1.2187186]}]},{"targetBoneName":"LeftArm","path":"ROTATION","interpolation":"LINEAR","keyframes":[{"timeSeconds":0,"value":[-0.17580232002547425,-0.14056575839327115,-0.24732831470110525,0.9424242763151297]},{"timeSeconds":0.16,"value":[-0.21053039506717355,-0.1496970851141661,-0.28237936680130377,0.9238666725594536]},{"timeSeconds":0.32,"value":[-0.2397478372643562,-0.1674058115549503,-0.3152914179537772,0.9028220148785634]},{"timeSeconds":0.46,"value":[-0.20322773271359215,-0.13364007134888506,-0.26736773270334097,0.9323911815836916]},{"timeSeconds":0.68,"value":[-0.17580232002547425,-0.14056575839327115,-0.24732831470110525,0.9424242763151297]},{"timeSeconds":0.92,"value":[-0.17580232002547425,-0.14056575839327115,-0.24732831470110525,0.9424242763151297]}]},{"targetBoneName":"RightArm","path":"ROTATION","interpolation":"LINEAR","keyframes":[{"timeSeconds":0,"value":[-0.3047493812906333,0.24110677467432165,0.1884457164571757,0.9019332291018353]},{"timeSeconds":0.16,"value":[-0.4284465733889312,0.016369419244332387,0.46892533642289025,0.7721881925577249]},{"timeSeconds":0.32,"value":[-0.0789053861453944,-0.08358160733251309,0.7565019319356723,0.6438112160645817]},{"timeSeconds":0.46,"value":[0.24303770713435743,0.24305462515714377,0.8668753114526423,0.361087685326541]},{"timeSeconds":0.68,"value":[-0.19855101119741064,0.0987870021353639,0.491973874571585,0.8418909257740077]},{"timeSeconds":0.92,"value":[-0.3047493812906333,0.24110677467432165,0.1884457164571757,0.9019332291018353]}]},{"targetBoneName":"RightForeArm","path":"ROTATION","interpolation":"LINEAR","keyframes":[{"timeSeconds":0,"value":[-0.555529376464625,0.5688053959914113,-0.04467201596884188,0.6048569619051749]},{"timeSeconds":0.16,"value":[-0.6857026882704115,0.4787461976258829,-0.014902916904822436,0.5480801078539688]},{"timeSeconds":0.32,"value":[-0.7268449489169565,0.2701716841569958,0.0033648779955929146,0.6314209047139271]},{"timeSeconds":0.46,"value":[-0.6732132816880476,-0.11195350905631068,0.12753819002177416,0.7197112610309484]},{"timeSeconds":0.68,"value":[-0.691973367705565,0.4139275033560541,0.013308995434582463,0.5913203454914815]},{"timeSeconds":0.92,"value":[-0.555529376464625,0.5688053959914113,-0.04467201596884188,0.6048569619051749]}]},{"targetBoneName":"RightShoulder","path":"ROTATION","interpolation":"LINEAR","keyframes":[{"timeSeconds":0,"value":[-0.32363568717888824,-0.4892407411921215,0.5173908610287734,0.6230651138251418]},{"timeSeconds":0.16,"value":[-0.5414008704799186,-0.39688425279447975,0.5948748784923121,0.44214462143750055]},{"timeSeconds":0.32,"value":[-0.7291527122875283,-0.359561584310023,0.5820574392294078,0.01615322537178631]},{"timeSeconds":0.46,"value":[0.6346347942091747,0.02669714238124489,-0.7398881743882886,0.2215658592114754]},{"timeSeconds":0.68,"value":[-0.588377204705345,-0.3613005406135298,0.6176413606921978,0.37655455633650997]},{"timeSeconds":0.92,"value":[-0.32363568717888824,-0.4892407411921215,0.5173908610287734,0.6230651138251418]}]},{"targetBoneName":"Spine","path":"ROTATION","interpolation":"LINEAR","keyframes":[{"timeSeconds":0,"value":[0.028014133203955446,-0.006987467450871895,0.0068304670497288614,0.9995597672772432]},{"timeSeconds":0.16,"value":[0.026953762032850756,-0.010349447947712288,0.12859524631640087,0.9912767758120221]},{"timeSeconds":0.32,"value":[0.025251085109483082,-0.013999966476373976,0.2653028290185435,0.9637327391731648]},{"timeSeconds":0.46,"value":[0.028657530807381638,0.0035160046316701273,-0.3518333939056622,0.9356172543151805]},{"timeSeconds":0.68,"value":[0.028656878173455955,-0.003521319908451507,-0.1150361387481584,0.9929416248810241]},{"timeSeconds":0.92,"value":[0.028014133203955446,-0.006987467450871895,0.0068304670497288614,0.9995597672772432]}]},{"targetBoneName":"Spine02","path":"ROTATION","interpolation":"LINEAR","keyframes":[{"timeSeconds":0,"value":[-0.1139957818251335,0.0010693493233148118,0.0017993445709653863,0.9934790287556231]},{"timeSeconds":0.16,"value":[-0.11346879352449116,0.011000667161363711,0.08837990017705426,0.9895417178991471]},{"timeSeconds":0.32,"value":[-0.1116973167678319,0.02280112297158469,0.19133102094777452,0.9748826896817809]},{"timeSeconds":0.46,"value":[-0.11038823772365179,-0.028471367268981824,-0.25539326016042163,0.960092756395304]},{"timeSeconds":0.68,"value":[-0.11365519339355157,-0.008870106908775289,-0.08479490513378249,0.9898553643242299]},{"timeSeconds":0.92,"value":[-0.1139957818251335,0.0010693493233148118,0.0017993445709653863,0.9934790287556231]}]}],"events":[]}